### ISSUE TITLE
[Bug] Unable to replay "ultimate" pcapng file

### ISSUE THREAD

**Issue by urbanhusky** [appneta/tcpreplay#930]
**Describe the bug**
When attempting to replay a specific pcapng file, tcpreplay exits with error code 0.
No traffic is replayed.
This also happens when only the first packet is extracted into a separate pcapng file.

**To Reproduce**

1. Download pcap from https://weberblog.net/the-ultimate-pcap/ 
2. Replay pcap on an interface, e.g. `tcpreplay -i enp4s0f1 "The Ultimate PCAP v20250325.pcapng"`
3. tcpreplay exits
4. no traffic was replayed

**Expected behavior**
Replaying that particular pcap should replay traffic contained within (even if it takes multiple years in realtime, as would be the case with that particular pcap).

**System:**
 - OS: Linux (tested on Ubuntu 24.04.2 LTS and other)
 - Tcpreplay Version 4.4.4 and 4.5.1
 
Even just removing all comments from the first packet, saving only that packet (as pcapng) and attempting to replay it does not work (tested on Ubuntu 24.04.2 LTS with tcpreplay 4.4.4):
```
[…]:~$ sudo tcpreplay -d 5 -v -i enp4s0f1 ./pcaps/ultimate\ -\ firstpacket\ -\ clearedcomments.pcapng
[sudo] password for […]:
DEBUG1 in sendpacket.c:sendpacket_open_pf() line 902: sendpacket: using PF_PACKET
DEBUG5 in utils.c:our_safe_malloc() line 51: Malloc'd 1248 bytes in sendpacket.c:sendpacket_open_pf() line 975
DEBUG5 in tcpdump.c:tcpdump_open() line 209: Opening tcpdump debug file: tcpdump.debug
DEBUG2 in tcpdump.c:tcpdump_open() line 220: Prepping tcpdump options...
DEBUG2 in tcpdump.c:tcpdump_fill_in_options() line 342: [child] Will execute: tcpdump  -n -l -r -
DEBUG5 in utils.c:our_safe_malloc() line 51: Malloc'd 3 bytes in tcpdump.c:tcpdump_fill_in_options() line 349
DEBUG5 in utils.c:our_safe_malloc() line 51: Malloc'd 3 bytes in tcpdump.c:tcpdump_fill_in_options() line 361
DEBUG5 in utils.c:our_safe_malloc() line 51: Malloc'd 3 bytes in tcpdump.c:tcpdump_fill_in_options() line 361
DEBUG2 in tcpdump.c:tcpdump_open() line 223: Starting tcpdump...
DEBUG2 in tcpdump.c:tcpdump_open() line 232: tcpdump pid: 686303
DEBUG2 in tcpdump.c:tcpdump_open() line 238: [parent] closing child read/write fd 8/7
DEBUG1 in utils.c:our_safe_pcap_next() line 154: No data found in packet
DEBUG2 in tcpdump.c:tcpdump_close() line 303: [parent] killing tcpdump pid: 686303
```

Saving the same packet as pcap replays successfully (though it is not possible to save the entire "ultimate" pcap as a .pcap file, Wireshark doesn't provide the option to do that - and it would not fix the issue that pcapng replay itself does not work reliably):
```
[…]:~$ sudo tcpreplay -d 5 -v -i enp4s0f1 ./pcaps/ultimate\ -\ firstpacket\ -\ clearedcomments.pcap
DEBUG1 in sendpacket.c:sendpacket_open_pf() line 902: sendpacket: using PF_PACKET
DEBUG5 in utils.c:our_safe_malloc() line 51: Malloc'd 1248 bytes in sendpacket.c:sendpacket_open_pf() line 975
DEBUG5 in tcpdump.c:tcpdump_open() line 209: Opening tcpdump debug file: tcpdump.debug
DEBUG2 in tcpdump.c:tcpdump_open() line 220: Prepping tcpdump options...
DEBUG2 in tcpdump.c:tcpdump_fill_in_options() line 342: [child] Will execute: tcpdump  -n -l -r -
DEBUG5 in utils.c:our_safe_malloc() line 51: Malloc'd 3 bytes in tcpdump.c:tcpdump_fill_in_options() line 349
DEBUG5 in utils.c:our_safe_malloc() line 51: Malloc'd 3 bytes in tcpdump.c:tcpdump_fill_in_options() line 361
DEBUG5 in utils.c:our_safe_malloc() line 51: Malloc'd 3 bytes in tcpdump.c:tcpdump_fill_in_options() line 361
DEBUG2 in tcpdump.c:tcpdump_open() line 223: Starting tcpdump...
DEBUG2 in tcpdump.c:tcpdump_open() line 232: tcpdump pid: 686318
DEBUG2 in tcpdump.c:tcpdump_open() line 238: [parent] closing child read/write fd 8/7
DEBUG2 in send_packets.c:send_packets() line 396: packet 1 caplen 60
DEBUG4 in send_packets.c:send_packets() line 441: This packet time: 1241422456s 122475usec
DEBUG2 in tcpdump.c:tcpdump_open() line 232: tcpdump pid: 0
DEBUG2 in tcpdump.c:tcpdump_open() line 259: [child] started the kid
DEBUG2 in tcpdump.c:tcpdump_open() line 274: [child] closing in fds 8/7/6/9
DEBUG2 in tcpdump.c:tcpdump_open() line 281: [child] Exec'ing tcpdump...
reading from file -, link-type EN10MB (Ethernet), snapshot length 262144
DEBUG4 in tcpdump.c:tcpdump_print() line 178: read 100 byte from tcpdump
09:34:16.1241422456 ARP, Reverse Request who-is 00:04:00:83:76:2c tell 00:04:00:83:76:2c, length 46
DEBUG2 in send_packets.c:send_packets() line 500: Sending packet #1
DEBUG1 in utils.c:our_safe_pcap_next() line 154: No data found in packet
DEBUG2 in tcpdump.c:tcpdump_close() line 303: [parent] killing tcpdump pid: 686318
Actual: 1 packets (60 bytes) sent in 0.000015 seconds
Rated: 4000000.0 Bps, 32.00 Mbps, 66666.66 pps
Statistics for network device: enp4s0f1
        Successful packets:        1
        Failed packets:            0
        Truncated packets:         0
        Retried packets (ENOBUFS): 0
        Retried packets (EAGAIN):  0
```

P.S.: saving the single packet pcap file as pcapng lets it play back fine - so the issue is probably due to the many interfaces in it or some other difference.

**Comment by fklassen** [comment]
The issue is that this is a pcapng file rather than a pcap file.

``` 
❯ file The\ Ultimate\ PCAP\ v20210721.pcapng 
The Ultimate PCAP v20210721.pcapng: pcapng capture file - version 1.0

❯ file test/test.pcap 
test/test.pcap: pcap capture file, microsecond ts (little-endian) - version 2.4 (Ethernet, capture length 262144)
```

This format can be read by Wireshark, but not much else. Programs that use `libpcap` must use PCAP format. e.g.

```
❯ tcpdump -r test/test.pcap 
reading from file test/test.pcap, link-type EN10MB (Ethernet), snapshot length 262144
20:16:19.466743 IP 172.16.11.12.64565 > 74.125.19.17.https: Flags [P.], seq 3336115408:3336115435, ack 3307089343, win 65535, options [nop,nop,TS val 444433452 ecr 935680176], length 27
20:16:19.467465 IP 172.16.11.12.64565 > 74.125.19.17.https: Flags [F.], seq 27, ack 1, win 65535, options [nop,nop,TS val 444433452 ecr 935680176], length 0
20:16:19.488320 IP 74.125.19.17.https > 172.16.11.12.64565: Flags [.], ack 27, win 283, options [nop,nop,TS val 935804965 ecr 444433452], length 0
20:16:19.488369 IP 172.16.11.12.64565 > 74.125.19.17.https: Flags [F.], seq 27, ack 1, win 65535, options [nop,nop,TS val 444433452 ecr 935804965], length 0
20:16:19.489327 IP 74.125.19.17.https > 172.16.11.12.64565: Flags [F.], seq 1, ack 27, win 283, options [nop,nop,TS val 935804965 ecr 444433452], length 0
20:16:19.489354 IP 172.16.11.12.64565 > 74.125.19.17.https: Flags [F.], seq 27, ack 2, win 65535, options [nop,nop,TS val 444433452 ecr 935804965], length 0
...

❯ sudo tcpdump -r The\ Ultimate\ PCAP\ v20210721.pcapng 
tcpdump: The Ultimate PCAP v20210721.pcapng: Permission denied
```

Closing.
